### ISSUE TITLE
ABB  IPS/S 3.1.1 KNX IP Interface is not getting discovered during the Discover operation.

### ISSUE THREAD

**Issue by aparnasb24** [calimero-project/calimero-tools#14]
Hi all,

I have an ABB IPS/S 3.1.1 KNX IP Interface.., and through this interface I am able to program the KNX devices from the ETS 6 project.
But the issue I am facing is during the Discover operation using the Calimero library, the interface is not getting discovered and I get the below response.

**03:10:22:526 INFO calimero.knxnetip.Discoverer - search stopped after 3 seconds with 0 responses**

But if i use the IP address associated with the IP interface.. I am able to perform operations like ScanDevices and DeviceInfo.

The Discovery of IP interface operation is not giving any results.., inspite of there being a interface in the same network.

Please if you could provide help on this issue. Since I am unable to discover the IP interface.

Thank you for your help!!

**Comment by aparnasb24** [comment]
Hi

We did check everything on the device end but we still facing issue with being able to discover the ABB IPS/S 3.1.1 KNX IP interface with **mask version 0012**.


We are still facing issues during the Discover operation using the Calimero library. Inspite of the interface being present in the network it is not getting discovered and I get the response as below:

**03:10:22:526 INFO calimero.knxnetip.Discoverer - search stopped after 3 seconds with 0 responses**

The Discovery of IP interface operation is not giving any results.., inspite of there being a interface in the same network.

Please if you could provide help on this issue. Since I am unable to discover the IP interface since we have tried all possibilities on the device end.

Please help us out if it is something missing from the Calimero library end.


Thank you for your help!!

**Comment by bmalinowsky** [comment]
The Discover tool has a `--unicast` option, did you check that? Also if `--nat` makes a difference.

Otherwise, try to get a description of your interface using the option `describe <host>`. 
You will have to know the IP of your interface for that, but you can check at least that unicast communication works.

You can also enable trace logging, in the file _resources/simplelogger.properties_, to see if there are any discrepancies.

Do you know if the device sends a response?

**Comment by aparnasb24** [comment]
Yes I did try the **--unicast** as well as the **--nat** option but it still does not discover the IP interface.

I did try the describe <host> option specifying the IP address of the IP interface and I am able to obtain the description about the IP interface.

But the issue I am facing is on performing the search operation on Discover tool I get the response as below

**03:10:22:526 INFO calimero.knxnetip.Discoverer - search stopped after 3 seconds with 0 responses**

But I am able to perform operations like Scandevices and DeviceInfo of all the devices in the same line.area combination using the IP address of the interface.

The issue that I am facing is on Discover I am not able to get the IP interface in the response.

Please help us out if we are missing anything while using the Calimero library for the Discover operations.


Thank you for your help!!

**Comment by aparnasb24** [comment]
Hi 

I did check it with the kip display filter on wireshark. And the KNX IP interface does show up in the wireshark traffic.

**KNX/IP Search Response, Control @ 192.168.x.xxx:3671,  1.1.255  "IPS/S3.1.1 IP Interface, MDRC"**

But when I perform a describe operation the IP it is using to obtain the description is in the same subnet but it ends with **.149** whereas the wireshark destination to which the source KNX IP interface is responding to is **.139**

Is this something because of which I am not able to receive responses during the KNX/net IP discovery.


Please help us out with information on the above issue.


Thank you for help!!

**Comment by bmalinowsky** [comment]
If the IP is not correct, a response won't likely show up. The response you see is using unicast. What if you use multicast, the response should be sent to 224.0.23.12?

**Comment by bmalinowsky** [comment]
You can check that in wireshark: a normal search should have in its request a HPAI response address of 224.0.23.12.
And a response will use that as destination. I just checked that.

If you use the option `--unicast`, the request will contain the host IP, and a response will use that as destination.

**Comment by aparnasb24** [comment]
Yes I receive only these when I perform a search operation using the Discover tool.

And obtain no response at all at the library's end after the execution of the search operation.

But I do get response on describe using the IP address of the IP interface and also the other operations like ScanDevices and DeviceInfo execute successfully for the interface.

Only issue is with the discovery of IP interface. Because of which I am unable to proceed further with the other operations that we want to achieve using the Calimero library.

Please help us out if something specific that the Calimero library requires on the KNX network where the devices are installed.


Thank you for your help!!

**Comment by aparnasb24** [comment]
On tracing the search with network interface using tcpdump and **filter as port 3671** I get the below packets in the trace.

**java -cp "calimero-tools-2.5.jar" tuwien.auto.calimero.tools.Discover search -i enp10s0f0**

![Calimero-netif](https://user-images.githubusercontent.com/95269363/158638069-243252ba-664f-464d-a460-131f6959702f.png)


And still I receive no responses on completion of the search operation using the Discover tool.

**Comment by aparnasb24** [comment]
Hi,

The issue with KNX IP interface not getting discovered still persists. Because of which we are unable to proceed with other tools like ScanDevices and DeviceInfo operations.


Currently we are running the Calimero library code in a Remote PC and trying to obtain responses from the real devices in the KNX installation that we have.

Previously when we were trying to access a KNX simulator which was locally present in the same network as our PC in which the Calimero library code was being executed we were able to perform the search operation and obtain the KNX IP interface in the search responses.


But now when we are executing the library code in a Remote PC and trying to access the KNX interfaces in the KNX installation, we are unable to receive responses on the search operation.


Is it a case where in the Calimero library discovery tool, will be unable to discover the IP interfaces if it is being executed in the Remote PC.


Please help us out with the above issue, since none of the options like search with --unicast, --nat or search by specifying the interface has been working for us.


Thank you for your help!!

**Comment by aparnasb24** [comment]
Hi,

Is there a way in which I can increase the timeout period for the search operation of the Discover tool. Since I was able to discover the KNX IP interface and obtain it in the responses just once in the past few days. I am assuming that the request is getting timed out even before the device sends response.  


So if you could please help us out, if we could increase the timeout period for the KNX interface discovery in the Discover tool in the Calimero tools.


Thank you for your help!!

**Comment by bmalinowsky** [comment]
Option `--timeout`, which is clearly stated in the tool help.

**Comment by aparnasb24** [comment]
Thank you for your reply. I did try increasing the timeout period but still I am unable to receive any responses during device discovery operation.

But in last few days of trying to obtain a response on discover operation. Today the interface responded for once. But apart from this one time, I am unable to obtain any responses inspite of the interface being present in the network.


Since this issue is present from a long time, we are unable to proceed further and perform other operations based on the responses.


Please help us out if there something in particular that needs to be done, for the Calimero library to be able to discover the interface.



Thank you for your help!!

**Comment by aparnasb24** [comment]
> Hi,
> 
> The issue with KNX IP interface not getting discovered still persists. Because of which we are unable to proceed with other tools like ScanDevices and DeviceInfo operations.
> 
> Currently we are running the Calimero library code in a Remote PC and trying to obtain responses from the real devices in the KNX installation that we have.
> 
> Previously when we were trying to access a KNX simulator which was locally present in the same network as our PC in which the Calimero library code was being executed we were able to perform the search operation and obtain the KNX IP interface in the search responses.
> 
> But now when we are executing the library code in a Remote PC and trying to access the KNX interfaces in the KNX installation, we are unable to receive responses on the search operation.
> 
> Is it a case where in the Calimero library discovery tool, will be unable to discover the IP interfaces if it is being executed in the Remote PC.
> 
> Please help us out with the above issue, since none of the options like search with --unicast, --nat or search by specifying the interface has been working for us.
> 
> Thank you for your help!!

This is how our setup is for the KNX installation and the Calimero library

**Comment by bmalinowsky** [comment]
I cannot help you if you keep restating previous posts, and you don't make progress with the observations gathered.

* Where does the IP address x.x.x.139 come from?
* What happens if you send a search request with a multicast as response. Does the ABB interface respond to that multicast group at all?
* What if you use the KNX simulator on a different host? Do you get an answer?
* Your tcpdump shows that no responses arrive at your host. Having no response if no message arrives is obvious. Does the ABB interface always receive a request and respond to it? Not sometimes, or sporadically, but when you monitor it.

**Comment by aparnasb24** [comment]
1. The IP address x.x.x.139 is of the PC that is in the same network as the IP interface and in which the ETS is installed for programming and x.x.x.149 is the remote host within which using ssh I have the Calimero library, and x.x.x.149 is the host I am obtaining on describe <host> operation as below:

**Using 192.168.1.149 (enp10s0f0)**
-------------------------------
"IPS/S3.1.1 IP Interface,MDRC",MDRC"
KNX address 1.1.255
KNX medium TP1
Installation 0 - Project 0 (ID 0)
KNX IP multicast address 0.0.0.0
MAC address 00:0c:da:49:82:f6
S/N 0002:2ca54ff52
Supported services: Core (v1), Device Management (v1), Tunneling (v1), Remote Configuration Diagnosis (v1)

And packets in tcpdump as below on describe<host> operation:

**10:28:07.029697 IP sclera.60404 > 192.168.1.101.3671: UDP, length 14
10:28:07.042798 IP 192.168.1.101.3671 > sclera.60404: UDP, length 70**

2. If I send a search request with multicast as response the ABB interface does not respond to the multicast group.
3. Yes KNX simulator was locally present in one PC and Calimero library in another PC and were able to discover the interface without any issues, but when we installed the KNX simulator in the remote PC, we were unable to obtain the responses.
4. The ABB interface did happen to respond once on discovery today, but unfortunately I was not having a tcpdump in execution while the process took place, so was not able to trace the packets.

The only packets that I receive on a search with (--unicast or  --nat or multicast search)  is as below with a port 3671 as the tcpdump filter.

**10:34:35.564456 IP sclera.39734 > 224.0.23.12.3671: UDP, length 22
10:34:35.564571 IP sclera.39734 > 224.0.23.12.3671: UDP, length 14
10:34:35.590489 IP sclera.52071 > 224.0.23.12.3671: UDP, length 22
10:34:35.590538 IP sclera.52071 > 224.0.23.12.3671: UDP, length 14**

These are all the observations that we were able to gather from tracing the KNX packets.

But one thing that we have observed is if I run the Calimero library in x.x.x.139 which is the PC that is physically present in the same network as the KNX installation, which also happens to be the PC where ETS has been installed for KNX device programming.

We are successfully able to obtain search responses for both the KNX simulator as well as the ABB KNX IP interface. Only issue we have been facing is while having the Calimero library executing in a remote PC through ssh which is in the same network as the KNX IP interface with the IP address x.x.x.149 and the ABB interface having the IP as x.x.x.101.


This is all the observations that we have made, since Calimero was working fine with our local system. We are unable to figure out what exactly could be causing this issue in a remote setup and please needed some help on it.


Thank you for your help!!

**Comment by bmalinowsky** [comment]
Regarding 4: if you have ETS running in parallel, it could be that the ABB interface is also responding to ETS search requests which you then observe.

Anyway, if you ssh into x.x.x.149 from your computer, you are in the same network as the ABB interface, so communication should not make a difference at all. Calimero does not know whether you use ssh or not.
You are basically saying that the problems are there if you use ssh, right?

**Comment by aparnasb24** [comment]
Basically if the ABB interface and the PC in which the Calimero library is running are physically connected using the same ethernet cable, then I obtain responses without any issues.

But when I run the Calimero library within x.x.x.149 through ssh to discover the ABB KNX interface, I am unable to obtain any responses on discovery.

So yes the issues are there if I use ssh to execute the Calimero library to discover the ABB interface.

**Comment by bmalinowsky** [comment]
If you ssh from your computer A into a computer B, where B is on the same network as the ABB interface, that computer B is also physically connected. I don't see how that could make a difference. How exactly are you using ssh?

**Comment by aparnasb24** [comment]
As I previously stated if I connect the ABB KNX interface and the PC in which Calimero is running to the same switch in the network, I am able to discover the interface in the discovery responses.

But when the PC in which the Calimero is running through ssh, and the ABB KNX interface are connected to different switches within the same network, I am unable to discover the ABB KNX interface, it seems like there is some issue with the multicast address during the search.

Search using --unicast, --nat also does not give any responses on discovery. Is it some settings that I need to be doing on the switches in the network. Since when connected to different switches within the same network, Calimero is unable to obtain any responses on discovery.

Please help us out if any specific settings is required on the network switch side, for the multicast address to function and to obtain search responses.


Thank you for your help!!

**Comment by bmalinowsky** [comment]
OK, now there are different switches. Are they forwarding multicasts? I seems the problem is in the network setup you use. I cannot realistically do a remote diagnosis on that.
